{
  "schema_version": "city-airport-potential-passenger-forecast-config-v1",
  "config_version": "beijing-airport-system-narrative-passenger-forecast-v1.3",
  "city_airport_market_id": "beijing_airport_system",
  "city_name": "北京",
  "region_id": "china_mainland",
  "region_name": "中国大陆",
  "design_note": "Narrative forecast model. Ordinary reports consume only coarse hidden direction, strength, turning-window and component demand/supply signals, then jointly generate total paths plus inherited component demand and airline-allocation paths. The God report remains an explicit development-only future peek.",
  "forecast_report_tier_catalog": "../forecast_report_tier_profiles/forecast_report_tier_profiles_v1.json",
  "forecast_narrative_catalog": "../forecast_narrative_profiles/forecast_narrative_profiles_v2.json",
  "timeline": {
    "simulation_start_year": 2025,
    "player_decision_start_year": 2030
  },
  "forecast": {
    "forecast_model_version": "narrative-component-passenger-forecast-v1.2",
    "as_of_frequency_years": 1,
    "forecast_horizon_min_years": 1,
    "forecast_horizon_max_years": 12,
    "forecast_horizon_step_years": 1,
    "naive_history_years": 5,
    "naive_long_term_growth_pct": 1.6,
    "naive_trend_fade_years": 24,
    "naive_growth_floor_pct": -2.5,
    "naive_growth_cap_pct": 5.0
  },
  "forecast_reports": [
    {
      "forecast_report_id": "public_consensus",
      "forecast_report_tier_profile_id": "initial_v1",
      "forecast_narrative_profile_id": "public_consensus_v2",
      "forecast_narrative_modifier_ids": ["consensus_herding_v2", "sticky_thesis_v2"],
      "forecast_report_display_name": "公开共识",
      "forecast_report_tier": "initial",
      "forecast_report_source": "public_consensus",
      "reported_confidence_style": "overconfident_consensus",
      "forecast_bias_direction": "mixed",
      "forecast_quality_score": 32,
      "dynamic_quality": {
        "enabled": true,
        "min_score": 18,
        "max_score": 50,
        "scope": "as_of_and_horizon"
      },
      "calibration_score": 18,
      "future_peek_mode": false,
      "forecast_horizon_max_years": 6,
      "derive_seed_signal_from_quality": true,
      "seed_signal_min_pct": 18,
      "seed_signal_max_pct": 55,
      "derive_bias_cap_from_quality": true,
      "bias_cap_at_score_0_pct": 20.0,
      "bias_cap_at_score_70_pct": 6.0,
      "consensus_herding_bias_cap_pct": 5.0,
      "reported_confidence_base_pct": 82.0,
      "reported_confidence_horizon_decay_pct": 1.25,
      "reported_confidence_noise_pct": 3.5,
      "default_reported_error_band_pct": 20.0,
      "reported_error_band_points": [
        {"horizon_years": 1, "value": 3.5},
        {"horizon_years": 3, "value": 5.5},
        {"horizon_years": 6, "value": 10.5}
      ]
    },
    {
      "forecast_report_id": "initial_local_bureau_note",
      "forecast_report_tier_profile_id": "initial_v1",
      "forecast_narrative_profile_id": "public_consensus_v2",
      "forecast_narrative_modifier_ids": ["pessimistic_v2", "slow_revision_v2"],
      "forecast_report_display_name": "公开共识",
      "forecast_report_tier": "initial",
      "forecast_report_source": "local_industry_note",
      "reported_confidence_style": "routine_local_note",
      "forecast_bias_direction": "mostly_pessimistic",
      "forecast_quality_score": 16,
      "calibration_score": 16,
      "future_peek_mode": false,
      "forecast_horizon_max_years": 6,
      "seed_signal_capture_pct": 16,
      "deterministic_bias_cap_pct": 15.0,
      "consensus_herding_bias_cap_pct": 2.0,
      "reported_confidence_base_pct": 74.0,
      "reported_confidence_horizon_decay_pct": 1.35,
      "reported_confidence_noise_pct": 4.0,
      "default_reported_error_band_pct": 18.0,
      "reported_error_band_points": [
        {"horizon_years": 1, "value": 4.5},
        {"horizon_years": 3, "value": 7.0},
        {"horizon_years": 6, "value": 13.0}
      ]
    },
    {
      "forecast_report_id": "initial_hot_story",
      "forecast_report_tier_profile_id": "initial_v1",
      "forecast_narrative_profile_id": "hot_growth_story_v2",
      "forecast_narrative_modifier_ids": ["trend_following_v2", "overconfident_v2"],
      "forecast_report_display_name": "增长叙事",
      "forecast_report_tier": "initial",
      "forecast_report_source": "market_hot_story",
      "reported_confidence_style": "overconfident_growth_story",
      "forecast_bias_direction": "mostly_optimistic",
      "forecast_quality_score": 8,
      "calibration_score": 12,
      "future_peek_mode": false,
      "forecast_horizon_max_years": 6,
      "seed_signal_capture_pct": 8,
      "deterministic_bias_cap_pct": 30.0,
      "consensus_herding_bias_cap_pct": 10.0,
      "reported_confidence_base_pct": 84.0,
      "reported_confidence_horizon_decay_pct": 1.05,
      "reported_confidence_noise_pct": 3.5,
      "default_reported_error_band_pct": 14.0,
      "reported_error_band_points": [
        {"horizon_years": 1, "value": 2.5},
        {"horizon_years": 3, "value": 4.0},
        {"horizon_years": 6, "value": 6.0}
      ]
    },
    {
      "forecast_report_id": "basic_research",
      "forecast_report_tier_profile_id": "middle_v1",
      "forecast_narrative_profile_id": "fundamental_research_v2",
      "forecast_narrative_modifier_ids": ["mean_reverting_v2", "wide_uncertainty_v2"],
      "forecast_report_display_name": "基本面研究",
      "forecast_report_tier": "middle",
      "forecast_report_source": "internal_research_basic",
      "reported_confidence_style": "confident_internal_report",
      "forecast_bias_direction": "mostly_pessimistic",
      "forecast_quality_score": 25,
      "calibration_score": 28,
      "future_peek_mode": false,
      "forecast_horizon_max_years": 8,
      "seed_signal_capture_pct": 30,
      "deterministic_bias_cap_pct": 8.5,
      "consensus_herding_bias_cap_pct": 3.5,
      "reported_confidence_base_pct": 76.0,
      "reported_confidence_horizon_decay_pct": 1.15,
      "reported_confidence_noise_pct": 3.0,
      "default_reported_error_band_pct": 21.0,
      "reported_error_band_points": [
        {"horizon_years": 1, "value": 4.0},
        {"horizon_years": 3, "value": 6.5},
        {"horizon_years": 6, "value": 12.0},
        {"horizon_years": 8, "value": 15.0}
      ]
    },
    {
      "forecast_report_id": "middle_balanced_panel",
      "forecast_report_tier_profile_id": "middle_v1",
      "forecast_narrative_profile_id": "balanced_benchmark_v2",
      "forecast_narrative_modifier_ids": ["wide_uncertainty_v2"],
      "forecast_report_display_name": "平衡基准",
      "forecast_report_tier": "middle",
      "forecast_report_source": "internal_research_panel",
      "reported_confidence_style": "balanced_internal_report",
      "forecast_bias_direction": "mixed",
      "forecast_quality_score": 38,
      "calibration_score": 42,
      "future_peek_mode": false,
      "forecast_horizon_max_years": 8,
      "seed_signal_capture_pct": 40,
      "deterministic_bias_cap_pct": 7.0,
      "consensus_herding_bias_cap_pct": 2.0,
      "reported_confidence_base_pct": 73.0,
      "reported_confidence_horizon_decay_pct": 1.05,
      "reported_confidence_noise_pct": 2.8,
      "default_reported_error_band_pct": 18.0,
      "reported_error_band_points": [
        {"horizon_years": 1, "value": 4.0},
        {"horizon_years": 3, "value": 6.0},
        {"horizon_years": 6, "value": 10.0},
        {"horizon_years": 8, "value": 13.0}
      ]
    },
    {
      "forecast_report_id": "middle_growth_desk",
      "forecast_report_tier_profile_id": "middle_v1",
      "forecast_narrative_profile_id": "fundamental_research_v2",
      "forecast_narrative_modifier_ids": ["optimistic_v2", "trend_following_v2"],
      "forecast_report_display_name": "基本面研究",
      "forecast_report_tier": "middle",
      "forecast_report_source": "internal_growth_desk",
      "reported_confidence_style": "growth_case_report",
      "forecast_bias_direction": "mostly_optimistic",
      "forecast_quality_score": 33,
      "calibration_score": 34,
      "future_peek_mode": false,
      "forecast_horizon_max_years": 8,
      "seed_signal_capture_pct": 34,
      "deterministic_bias_cap_pct": 9.0,
      "consensus_herding_bias_cap_pct": 3.0,
      "reported_confidence_base_pct": 78.0,
      "reported_confidence_horizon_decay_pct": 1.0,
      "reported_confidence_noise_pct": 3.0,
      "default_reported_error_band_pct": 18.0,
      "reported_error_band_points": [
        {"horizon_years": 1, "value": 3.5},
        {"horizon_years": 3, "value": 6.0},
        {"horizon_years": 6, "value": 11.0},
        {"horizon_years": 8, "value": 14.0}
      ]
    },
    {
      "forecast_report_id": "professional_consulting",
      "forecast_report_tier_profile_id": "high_v1",
      "forecast_narrative_profile_id": "balanced_benchmark_v2",
      "forecast_narrative_modifier_ids": ["wide_uncertainty_v2"],
      "forecast_report_display_name": "平衡基准",
      "forecast_report_tier": "high",
      "forecast_report_source": "professional_consulting",
      "reported_confidence_style": "balanced_professional",
      "forecast_bias_direction": "mixed",
      "forecast_quality_score": 48,
      "calibration_score": 55,
      "future_peek_mode": false,
      "forecast_horizon_max_years": 10,
      "seed_signal_capture_pct": 52,
      "deterministic_bias_cap_pct": 5.5,
      "consensus_herding_bias_cap_pct": 1.5,
      "reported_confidence_base_pct": 72.0,
      "reported_confidence_horizon_decay_pct": 1.05,
      "reported_confidence_noise_pct": 2.5,
      "default_reported_error_band_pct": 20.0,
      "reported_error_band_points": [
        {"horizon_years": 1, "value": 3.5},
        {"horizon_years": 3, "value": 5.5},
        {"horizon_years": 6, "value": 9.5},
        {"horizon_years": 10, "value": 15.0}
      ]
    },
    {
      "forecast_report_id": "high_data_model",
      "forecast_report_tier_profile_id": "high_v1",